{
  "artifact_id": "related-action-differential-reviews:f000477:justice_public_safety:119:v4",
  "content_subject_sha256": "73d374f8fbe15c3790e97de0b33827a51c0852eeba1ae1b91ff0e7e5a3a6a3c0",
  "non_authorizing": true,
  "review_count": 4,
  "reviews": [
    {
      "action_ids": [
        "house:119:1:6",
        "house:119:1:23"
      ],
      "added_or_removed_provisions": [
        "S. 5 adds assault of a law-enforcement officer to the detention triggers",
        "S. 5 adds crimes resulting in death or serious bodily injury to the detention triggers"
      ],
      "benchmark_used": false,
      "candidate_blind_primary_generation": true,
      "changed_thresholds_dates_penalties_or_exceptions": [
        "S. 5 adds assault of a law-enforcement officer to the detention triggers",
        "S. 5 adds crimes resulting in death or serious bodily injury to the detention triggers"
      ],
      "content_subject_sha256": "9a3db3607e8c16e7b9e4087da86a912271ca538bc6a2dbcea571955b873197e3",
      "group_id": "laken-riley-house-senate-versions",
      "highest_severity": "none",
      "initial_findings": [
        {
          "final_state": "represented",
          "finding_id": "s5-added-detention-triggers",
          "initial_state": "represented",
          "required_exact_version_difference": [
            "assault of a law-enforcement officer",
            "crimes resulting in death or serious bodily injury"
          ],
          "severity": "none"
        }
      ],
      "near_duplicate_wording_rejected_when_text_differs": true,
      "relationship_basis": [
        "shared official short title",
        "same detention-and-State-enforcement policy mechanism",
        "different exact measure identity and governed operative version"
      ],
      "remaining_severity_after_correction": "none",
      "required_differences": [
        "S. 5 adds assault of a law-enforcement officer to the detention triggers",
        "S. 5 adds crimes resulting in death or serious bodily injury to the detention triggers"
      ],
      "review_contract_version": "related_action_differential_review_v4",
      "review_id": "related-action-differential-review:laken-riley-house-senate-versions:v4",
      "shared_provisions": [
        "detention and DHS-detainer coverage for burglary, theft, larceny, and shoplifting triggers",
        "State attorney-general enforcement over specified detention, release, parole, and visa duties, including the governed financial-harm threshold"
      ],
      "source_first_fingerprints": [
        {
          "action_id": "house:119:1:6",
          "expected_limit_wordings": [
            "State enforcement standing uses a claimed-harm threshold that includes financial harm over $100."
          ],
          "expected_provision_wordings": [
            "Require detention and DHS detainers for covered noncitizens connected to specified theft offenses.",
            "Create State attorney-general enforcement actions concerning specified immigration detention, release, parole, and visa duties."
          ],
          "inventory_content_subject_sha256": "7b5dc492d5a04e3b1b16eead32b364cca171d85d1d033e5f82259b8189353c09",
          "quantities_and_enumerations": []
        },
        {
          "action_id": "house:119:1:23",
          "expected_limit_wordings": [
            "State enforcement standing uses a claimed-harm threshold that includes financial harm over $100."
          ],
          "expected_provision_wordings": [
            "Require detention and DHS detainers for covered noncitizens connected to burglary, theft, larceny, shoplifting, assault of a law-enforcement officer, or crimes resulting in death or serious bodily injury.",
            "Create State attorney-general enforcement actions concerning specified immigration detention, release, parole, and visa duties."
          ],
          "inventory_content_subject_sha256": "6848f13fe8036136440d7e862292e6e063a49d7393fd3d6243a0d9d8712c20d9",
          "quantities_and_enumerations": []
        }
      ]
    },
    {
      "action_ids": [
        "house:119:1:33",
        "house:119:1:166"
      ],
      "added_or_removed_provisions": [
        "S. 331 is the Senate-origin enrolled version",
        "the exact operative packages use distinct technical-correction and implementation structures"
      ],
      "benchmark_used": false,
      "candidate_blind_primary_generation": true,
      "changed_thresholds_dates_penalties_or_exceptions": [
        "S. 331 is the Senate-origin enrolled version",
        "the exact operative packages use distinct technical-correction and implementation structures"
      ],
      "content_subject_sha256": "cd2457693313bbe0ba07992c829a3b48d1a79b259afaf529eda4662deeb10556",
      "group_id": "halt-fentanyl-house-senate-versions",
      "highest_severity": "none",
      "initial_findings": [],
      "near_duplicate_wording_rejected_when_text_differs": true,
      "relationship_basis": [
        "same fentanyl-related-substances scheduling policy family",
        "House and Senate-origin measures with distinct governed texts"
      ],
      "remaining_severity_after_correction": "none",
      "required_differences": [
        "S. 331 is the Senate-origin enrolled version",
        "the exact operative packages use distinct technical-correction and implementation structures"
      ],
      "review_contract_version": "related_action_differential_review_v4",
      "review_id": "related-action-differential-review:halt-fentanyl-house-senate-versions:v4",
      "shared_provisions": [
        "permanent Schedule I treatment for fentanyl-related substances as a class",
        "research registration pathways for Schedule I work",
        "specified Controlled Substances Act and import-export penalty treatment"
      ],
      "source_first_fingerprints": [
        {
          "action_id": "house:119:1:33",
          "expected_limit_wordings": [
            "The class definition excludes substances specifically exempted or listed in another schedule."
          ],
          "expected_provision_wordings": [
            "Place fentanyl-related substances in schedule I as a class.",
            "Create alternative and expedited registration procedures for specified schedule I research.",
            "Apply specified Controlled Substances Act penalties to fentanyl-related substances.",
            "Require implementing rules and address applicability."
          ],
          "inventory_content_subject_sha256": "23502f83ff4b67b1d07cff427e8082860ed2b9ba150f4e28aaf8fe23b6da97a2",
          "quantities_and_enumerations": []
        },
        {
          "action_id": "house:119:1:166",
          "expected_limit_wordings": [
            "The class definition excludes substances specifically exempted or listed in another schedule."
          ],
          "expected_provision_wordings": [
            "Permanently place fentanyl-related substances in schedule I as a class.",
            "Create alternative and expedited registration pathways for schedule I research.",
            "Require implementing rules and technical corrections.",
            "Apply specified Controlled Substances Act and import-export penalties."
          ],
          "inventory_content_subject_sha256": "9a044fd5acb49173aaaceefd4284cecda1706611c74ff941249d9c25d4fbf598",
          "quantities_and_enumerations": []
        }
      ]
    },
    {
      "action_ids": [
        "house:119:2:155",
        "house:119:2:221"
      ],
      "added_or_removed_provisions": [
        "roll 155 changes April 30, 2026 to June 12, 2026",
        "roll 221 changes June 12, 2026 to July 2, 2026",
        "roll 155 retains a governed source-identity conflict not present for roll 221"
      ],
      "benchmark_used": false,
      "candidate_blind_primary_generation": true,
      "changed_thresholds_dates_penalties_or_exceptions": [
        "roll 155 changes April 30, 2026 to June 12, 2026",
        "roll 221 changes June 12, 2026 to July 2, 2026",
        "roll 155 retains a governed source-identity conflict not present for roll 221"
      ],
      "content_subject_sha256": "5298c149e8c68adc3348e4f4ea9ce02f0257c49413e452e9ecc66a471fe17d0b",
      "group_id": "fisa-short-term-extensions",
      "highest_severity": "none",
      "initial_findings": [],
      "near_duplicate_wording_rejected_when_text_differs": true,
      "relationship_basis": [
        "same two Title VII sunset references",
        "same short-term extension mechanism with different dates"
      ],
      "remaining_severity_after_correction": "none",
      "required_differences": [
        "roll 155 changes April 30, 2026 to June 12, 2026",
        "roll 221 changes June 12, 2026 to July 2, 2026",
        "roll 155 retains a governed source-identity conflict not present for roll 221"
      ],
      "review_contract_version": "related_action_differential_review_v4",
      "review_id": "related-action-differential-review:fisa-short-term-extensions:v4",
      "shared_provisions": [
        "short-term extension of the same two Title VII FISA repeal-date references"
      ],
      "source_first_fingerprints": [
        {
          "action_id": "house:119:2:155",
          "expected_limit_wordings": [
            "Take effect on the earlier of enactment or April 29, 2026."
          ],
          "expected_provision_wordings": [
            "Extend two Title VII repeal-date references from April 30, 2026, to June 12, 2026."
          ],
          "inventory_content_subject_sha256": "07143da38e55582bd99c0537e4868bf8c571e4db9f663fc208c069e036708610",
          "quantities_and_enumerations": []
        },
        {
          "action_id": "house:119:2:221",
          "expected_limit_wordings": [
            "Take effect on the earlier of enactment or June 11, 2026."
          ],
          "expected_provision_wordings": [
            "Extend two Title VII repeal-date references from June 12, 2026, to July 2, 2026."